"名称","类型","资质信息"
"诚信会计事务所","合伙制","会计师事务所执业证书、注册会计师若干"
"卓越会计事务所","有限责任公司","ISO 质量管理体系认证、行业荣誉证书"
"恒信会计事务所","合伙制","税务代理资质、财务审计资格"
"明达会计事务所","有限责任公司","高新技术企业审计资格、资产评估资格"
"智汇会计事务所","合伙制","涉密资质认定、企业清算审计资格"
"广进会计事务所","有限责任公司","行政事业单位审计资格、工程造价审计资格"
"丰泽会计事务所","合伙制","农村财务审计资格、管理咨询资质"
"瑞华会计事务所","有限责任公司","内部控制审计资格、尽职调查资质"
"金诚会计事务所","合伙制","财政支出绩效评价资格、司法会计鉴定资格"
"中汇会计事务所","有限责任公司","金融企业审计资格、企业重组审计资格"
"华瑞会计事务所","合伙制","新三板挂牌审计资格、财务尽职调查资质"
"正信会计事务所","有限责任公司","清产核资审计资格、基建项目审计资格"
"天衡会计事务所","合伙制","经济效益审计资格、外汇审计资格"
"立信会计事务所","有限责任公司","集团企业审计资格、财务报表审阅资质"
"永拓会计事务所","合伙制","非营利组织审计资格、专项资金审计资格"
"中兴华会计事务所","有限责任公司","企业破产清算审计资格、管理建议书资质"
"亚太会计事务所","合伙制","财务收支审计资格、财务咨询服务资质"
"大信会计事务所","有限责任公司","风险评估资质、企业价值评估资格"
"利安达会计事务所","合伙制","业绩预测审核资格、代编财务信息资质"
"天职国际会计事务所","有限责任公司","预算审计资格、并购重组咨询资质"
"众华会计事务所","合伙制","IT 审计资格、内部审计服务资质"
"苏亚金诚会计事务所","有限责任公司","验资资格、税务筹划资质"
"天健会计事务所","合伙制","中期财务报告审计资格、内部控制评价资质"
"信永中和会计事务所","有限责任公司","财务分析资质、关联交易审计资格"
"国富浩华会计事务所","合伙制","财务舞弊审计资格、成本核算咨询资质"
"致同会计事务所","有限责任公司","经济效益评估资格、投资项目评估资质"
"大华会计事务所","有限责任公司","财务规范辅导资质、税收优惠申请咨询资格"
"中审众环会计事务所","合伙制","资产清查审计资格、财务流程优化建议资质"
"中审亚太会计事务所","有限责任公司","清产核资评估资格、财务风险预警咨询资质"
"华兴会计事务所","合伙制","竣工决算审计资格、财务模型构建服务资质"
"中勤万信会计事务所","有限责任公司","财务信息化咨询资质、财务人员培训资质"
"中天运会计事务所","合伙制","集团合并报表审计资格、预算管理咨询资质"
"北京兴华会计事务所","有限责任公司","财务造假甄别资质、财务战略规划咨询资格"
"希格玛会计事务所","合伙制","政府补贴审计资格、财务制度设计资质"
"上会会计事务所","有限责任公司","财政资金审计资格、财务对标分析服务资质"
"公证天业会计事务所","合伙制","财务数据安全审计资格、财务合规性审查资质"
"和信会计事务所","有限责任公司","财务报表重述审计资格、财务报告翻译服务资质"
"中证天通会计事务所","合伙制","财务信息系统审计资格、财务纠纷调解服务资质"
"永恩会计事务所","有限责任公司","海关业务审计资格、财务决策支持服务资质"
"沪港金茂会计事务所","合伙制","外汇业务审计资格、财务管理软件推荐资质"
"新联谊会计事务所","有限责任公司","碳排放审计资格、财务云服务咨询资质"
"天圆全会计事务所","合伙制","社会责任报告审计资格、财务共享中心建设咨询资质"